{
  "schema_version": 1,
  "diagram_type": "architecture",
  "meta": {
    "title": "ConverData — Arquitectura cloud native en AWS",
    "output": "docs/architecture/cloud-native-architecture.html",
    "locale": "es",
    "quality_profile": "showcase"
  },
  "components": [
    {
      "id": "cognito",
      "type": "security",
      "label": "Amazon Cognito",
      "sublabel": "SSO con IdP corporativo",
      "pos": [
        280,
        40
      ],
      "size": [
        160,
        64
      ],
      "description": "Identidad de aplicación. Federa el SSO corporativo y emite el JWT que validan el ALB, AgentCore Runtime y AgentCore Gateway. Su 'sub' identifica al usuario en todo el sistema y es la clave para recuperar sus logins SQL, y el claim cognito:groups da sus grupos (ACL de documentos, roles de curación), de modo que nunca se usa una identidad que el LLM pueda inventar. (F14, CN-01, CN-03)"
    },
    {
      "id": "bedrock",
      "type": "cloud",
      "label": "Amazon Bedrock",
      "sublabel": "Claude · Nova · Cohere",
      "pos": [
        760,
        40
      ],
      "size": [
        160,
        64
      ],
      "tag": "sin invocation logging",
      "description": "Cerebro de los agentes. Sirve un modelo por rol: Claude Sonnet para planificar y escribir T-SQL, Haiku para tareas rápidas, Nova o Llama como juez independiente y Cohere multilingüe para embeddings. Guardrails filtra la inyección de prompt en la entrada y la salida. Invocation logging desactivado: procesa sin guardar. NIM queda como fallback controlado. (F16, CN-06)"
    },
    {
      "id": "mcpclient",
      "type": "external",
      "label": "Cliente MCP",
      "sublabel": "Claude / IDE",
      "pos": [
        1000,
        40
      ],
      "size": [
        160,
        64
      ],
      "description": "Clientes externos como Claude Desktop, Claude Code o un IDE, que consumen ConverData como herramienta MCP (normalmente 'discover' o 'ask'). Entran por AgentCore Gateway con OAuth de Cognito y heredan los mismos permisos SQL que en el chat. (F12, CN-04)"
    },
    {
      "id": "opensearch",
      "type": "database",
      "label": "OpenSearch Serverless",
      "sublabel": "solo metadatos",
      "pos": [
        1240,
        40
      ],
      "size": [
        160,
        64
      ],
      "description": "Memoria semántica: búsqueda híbrida k-NN + BM25 sobre tablas, columnas, glosario, plantillas de golden SQL y de golden discovery, fragmentos redactados de documentos, reglas de negocio, linaje ETL y anotaciones de responsables. Filtra siempre por los objetos que el usuario puede ver. Solo guarda metadatos, conocimiento redactado y plantillas anonimizadas, nunca valores de clientes. (F2, F4, F22, F23, CN-02, CN-06)"
    },
    {
      "id": "users",
      "type": "external",
      "label": "Usuario",
      "sublabel": "navegador",
      "pos": [
        40,
        200
      ],
      "size": [
        160,
        64
      ],
      "description": "Ingenieros de datos, analistas, científicos de datos y Product Owners que preguntan en lenguaje natural dónde está un dato (descubrimiento) o piden los datos (consulta). En descubrimiento reciben campos y tablas candidatas con ambiente, servidor, descripción, reglas, relaciones y confianza, y confirman con ✔/✖; en consulta, tabla, gráfico, SQL usado y supuestos. Solo ven lo que su login SQL puede leer. (F12, F14, F22)"
    },
    {
      "id": "edge",
      "type": "security",
      "label": "WAF + ALB",
      "sublabel": "auth Cognito",
      "pos": [
        280,
        200
      ],
      "size": [
        160,
        64
      ],
      "description": "Puerta de entrada. AWS WAF bloquea abuso y aplica rate limiting; el ALB termina TLS y obliga a autenticarse con Cognito antes de llegar a la aplicación. No registra cuerpos de petición, así que las preguntas no quedan en logs. (CN-01, CN-06, CN-04)"
    },
    {
      "id": "ecs",
      "type": "frontend",
      "label": "Chainlit + BFF",
      "sublabel": "ECS Fargate",
      "pos": [
        520,
        200
      ],
      "size": [
        160,
        64
      ],
      "description": "Interfaz web Chainlit y API REST (FastAPI BFF) en ECS Fargate. Muestra los pasos del flow en vivo, las tarjetas de candidatos, las tablas y los gráficos; reenvía el JWT del usuario a AgentCore Runtime y transmite la respuesta en streaming. El feedback, la curación y el alta de credenciales van a las herramientas internas de converdata-mcp. Data layer de Chainlit desactivado: no persiste chats; las descargas CSV/XLSX van directas al navegador. (F12, CN-04, CN-06)"
    },
    {
      "id": "runtime",
      "type": "backend",
      "label": "AgentCore Runtime",
      "sublabel": "DiscoverFlow + AskFlow",
      "pos": [
        760,
        200
      ],
      "size": [
        160,
        64
      ],
      "tag": "historial solo en sesión",
      "description": "Ejecuta los grafos de LangGraph con pasos fijos y salida estructurada. DiscoverFlow (caso principal): recupera candidatos del catálogo y del conocimiento, los reordena, calcula la confianza y añade relaciones, reglas y responsables, sin consultar datos. AskFlow: intención, schema linking, valores, planificación T-SQL o SP, validación con autocorrección, ejecución, verificación y análisis. Cada sesión corre en una microVM aislada; el historial vive solo ahí. Envía telemetría sin contenido a CloudWatch. (F3–F10, F22, CN-01)"
    },
    {
      "id": "gateway",
      "type": "backend",
      "label": "AgentCore Gateway",
      "sublabel": "endpoint MCP",
      "pos": [
        1000,
        200
      ],
      "size": [
        160,
        64
      ],
      "description": "Punto único MCP. Publica las herramientas de converdata-mcp (discover, get_asset, get_lineage, where_is, search_catalog, describe_table, validate_sql, run_select, exec_procedure, ask, entre otras) con OAuth, y propaga la identidad del usuario al target para que los permisos se hereden. Las herramientas internas de feedback y curación solo se exponen con el scope converdata/internal del BFF, nunca a clientes MCP externos. (F12, F22, CN-01, CN-04)"
    },
    {
      "id": "mcp",
      "type": "backend",
      "label": "converdata-mcp",
      "sublabel": "Runtime modo VPC",
      "pos": [
        1240,
        200
      ],
      "size": [
        160,
        64
      ],
      "description": "Servidor MCP propio, en AgentCore Runtime en modo VPC. Busca en el catálogo, valida el SQL (AST, objetos visibles, NOEXEC, SHOWPLAN) y ejecuta SELECT y SPs de la lista blanca con el login SQL del propio usuario en cada servidor. Es el único camino de escritura: auditoría, golden y solicitudes de curación en ConverData_Audit on-prem, y ediciones humanas y plantillas de golden discovery en S3. Es el único componente que toca SQL Server en tiempo de consulta. (F7, F8, F12, F14, F24, CN-03, CN-05)"
    },
    {
      "id": "secrets",
      "type": "security",
      "label": "Secrets Manager",
      "sublabel": "login SQL por usuario",
      "pos": [
        1480,
        200
      ],
      "size": [
        160,
        64
      ],
      "tag": "CMK KMS",
      "description": "Guarda el login SQL de cada usuario por servidor (converdata/sql-logins/<sub>/<server>), cifrado con una CMK de KMS dedicada. Solo el rol de converdata-mcp puede leerlo, y solo para el usuario del JWT. Permite que cada consulta corra con los permisos reales de SQL Server. CloudTrail audita cada lectura. Son credenciales, no datos de clientes. (F14, CN-03)"
    },
    {
      "id": "tgw",
      "type": "cloud",
      "label": "Transit Gateway",
      "sublabel": "Site-to-Site VPN / DX",
      "pos": [
        1240,
        360
      ],
      "size": [
        160,
        64
      ],
      "description": "Conectividad privada entre la VPC y la red on-prem por Site-to-Site VPN o Direct Connect. Todo el tráfico TDS (puerto 1433) hacia SQL Server pasa por aquí, sin internet. El firewall on-prem solo abre el 1433 a las subredes de AgentCore y del Catalog Builder. (CN-01)"
    },
    {
      "id": "sqlserver",
      "type": "database",
      "label": "SQL Server",
      "sublabel": "varias BDs on-prem",
      "pos": [
        1480,
        360
      ],
      "size": [
        160,
        64
      ],
      "description": "Fuente de verdad de los datos, que permanece on-premise. Aplica los permisos reales de cada login: es la barrera de seguridad final aunque fallen los controles de la aplicación. Los resultados viajan a AWS solo para procesarse en memoria y mostrarse. (F8, F14, CN-06)"
    },
    {
      "id": "scheduler",
      "type": "messagebus",
      "label": "EventBridge Scheduler",
      "sublabel": "nocturno / bajo demanda",
      "pos": [
        760,
        520
      ],
      "size": [
        160,
        64
      ],
      "description": "Dispara el Catalog Builder cada noche y bajo demanda (Step Functions), para que el catálogo refleje los cambios de esquema sin intervención manual. (F1, CN-01, CN-02)"
    },
    {
      "id": "catalog",
      "type": "backend",
      "label": "Catalog Builder",
      "sublabel": "ECS task · F1 + F19 + F23",
      "pos": [
        1000,
        520
      ],
      "size": [
        160,
        64
      ],
      "description": "Tarea ECS que mapea todas las BDs y ambientes: lee la estructura con converdata-discovery (biblioteca), construye el grafo del patrimonio de datos entre BDs, ingiere diccionarios y documentos (SMB por la VPN o SharePoint por Graph con egress filtrado), paquetes SSIS, jobs de SQL Agent y reglas de negocio, redacta los datos personales con Presidio en memoria antes de escribir, propone métricas y genera descripciones con Bedrock. Escribe YAML revisable en S3, sin valores de datos. Es incremental. (F1, F19, F21, F23, CN-02)"
    },
    {
      "id": "discovery",
      "type": "backend",
      "label": "converdata-discovery",
      "sublabel": "MCP propio Apache-2.0",
      "pos": [
        1240,